[
  {
    "case_id": "R-OBV-001",
    "name": "pkm prefix override",
    "bucket": "obvious",
    "failure_tags": [
      "prefix_override"
    ],
    "input": {
      "text": "pkm: remember to buy milk"
    },
    "expect": {
      "route": "pkm_capture"
    }
  },
  {
    "case_id": "R-OBV-002",
    "name": "slash command passthrough",
    "bucket": "obvious",
    "failure_tags": [
      "slash_passthrough"
    ],
    "input": {
      "text": "/help"
    },
    "expect": {
      "route": "pkm_capture"
    }
  },
  {
    "case_id": "R-OBV-003",
    "name": "cal prefix create",
    "bucket": "obvious",
    "failure_tags": [
      "prefix_override"
    ],
    "input": {
      "text": "cal: Mila dentist tomorrow at 3:00p"
    },
    "expect": {
      "route": "calendar_create"
    }
  },
  {
    "case_id": "R-OBV-004",
    "name": "cal prefix query",
    "bucket": "obvious",
    "failure_tags": [
      "prefix_override"
    ],
    "input": {
      "text": "cal: what do we have tomorrow?"
    },
    "expect": {
      "route": "calendar_query"
    }
  },
  {
    "case_id": "R-OBV-005",
    "name": "obvious calendar query tomorrow",
    "bucket": "obvious",
    "failure_tags": [
      "baseline_route"
    ],
    "input": {
      "text": "what do we have tomorrow on calendar?"
    },
    "expect": {
      "route": "calendar_query"
    }
  },
  {
    "case_id": "R-OBV-006",
    "name": "weekday list query",
    "bucket": "obvious",
    "failure_tags": [
      "baseline_route"
    ],
    "input": {
      "text": "list events friday"
    },
    "expect": {
      "route": "calendar_query"
    }
  },
  {
    "case_id": "R-OBV-007",
    "name": "calendar question sunday",
    "bucket": "obvious",
    "failure_tags": [
      "baseline_route"
    ],
    "input": {
      "text": "do we have plans sunday?"
    },
    "expect": {
      "route": "calendar_query"
    }
  },
  {
    "case_id": "R-OBV-008",
    "name": "anything planned query",
    "bucket": "obvious",
    "failure_tags": [
      "baseline_route"
    ],
    "input": {
      "text": "anything planned tomorrow?"
    },
    "expect": {
      "route": "calendar_query"
    }
  },
  {
    "case_id": "R-OBV-009",
    "name": "dentist create",
    "bucket": "obvious",
    "failure_tags": [
      "baseline_route"
    ],
    "input": {
      "text": "Mila dentist tomorrow at 3:00p"
    },
    "expect": {
      "route": "calendar_create"
    }
  },
  {
    "case_id": "R-OBV-010",
    "name": "vet create",
    "bucket": "obvious",
    "failure_tags": [
      "baseline_route"
    ],
    "input": {
      "text": "book Louie vet friday at 9:00a"
    },
    "expect": {
      "route": "calendar_create"
    }
  },
  {
    "case_id": "R-OBV-011",
    "name": "appointment create",
    "bucket": "obvious",
    "failure_tags": [
      "baseline_route"
    ],
    "input": {
      "text": "appointment monday at 10:00a for Igor"
    },
    "expect": {
      "route": "calendar_create"
    }
  },
  {
    "case_id": "R-OBV-012",
    "name": "birthday create",
    "bucket": "obvious",
    "failure_tags": [
      "baseline_route"
    ],
    "input": {
      "text": "birthday party saturday at 1:00p for Mila"
    },
    "expect": {
      "route": "calendar_create"
    }
  },
  {
    "case_id": "R-OBV-013",
    "name": "iso-date create",
    "bucket": "obvious",
    "failure_tags": [
      "baseline_route"
    ],
    "input": {
      "text": "add trip on 2026-04-10 at 6:30p"
    },
    "expect": {
      "route": "calendar_create"
    }
  },
  {
    "case_id": "R-OBV-014",
    "name": "create verb create",
    "bucket": "obvious",
    "failure_tags": [
      "baseline_route"
    ],
    "input": {
      "text": "create family event tomorrow at 7:00p"
    },
    "expect": {
      "route": "calendar_create"
    }
  },
  {
    "case_id": "R-OBV-015",
    "name": "remind create",
    "bucket": "obvious",
    "failure_tags": [
      "baseline_route"
    ],
    "input": {
      "text": "remind Mila school pickup tomorrow 4:00p"
    },
    "expect": {
      "route": "calendar_create"
    }
  },
  {
    "case_id": "R-OBV-016",
    "name": "book create",
    "bucket": "obvious",
    "failure_tags": [
      "baseline_route"
    ],
    "input": {
      "text": "book dentist for Mila tomorrow at 2:15p"
    },
    "expect": {
      "route": "calendar_create"
    }
  },
  {
    "case_id": "R-OBV-017",
    "name": "show calendar monday",
    "bucket": "obvious",
    "failure_tags": [
      "baseline_route"
    ],
    "input": {
      "text": "show calendar monday"
    },
    "expect": {
      "route": "calendar_query"
    }
  },
  {
    "case_id": "R-OBV-018",
    "name": "calendar tomorrow query",
    "bucket": "obvious",
    "failure_tags": [
      "baseline_route"
    ],
    "input": {
      "text": "calendar tomorrow?"
    },
    "expect": {
      "route": "calendar_query"
    }
  },
  {
    "case_id": "R-OBV-019",
    "name": "pkm prefix calendar-looking text",
    "bucket": "obvious",
    "failure_tags": [
      "prefix_override"
    ],
    "input": {
      "text": "pkm: calendar tomorrow 3pm"
    },
    "expect": {
      "route": "pkm_capture"
    }
  },
  {
    "case_id": "R-OBV-020",
    "name": "explicit query with events",
    "bucket": "obvious",
    "failure_tags": [
      "baseline_route"
    ],
    "input": {
      "text": "what events do we have on tuesday?"
    },
    "expect": {
      "route": "calendar_query"
    }
  },
  {
    "case_id": "R-OBV-021",
    "name": "Cal prefix query #2",
    "bucket": "obvious",
    "failure_tags": [
      "prefix_override"
    ],
    "input": {
      "text": "Cal: what do we have tomorrow?"
    },
    "expect": {
      "route": "calendar_query"
    }
  },
  {
    "case_id": "R-OBV-022",
    "name": "appointment create #2",
    "bucket": "obvious",
    "failure_tags": [
      "baseline_route"
    ],
    "input": {
      "text": "appt monday at 10:00a for Igor"
    },
    "expect": {
      "route": "calendar_create"
    }
  },
  {
    "case_id": "R-OBV-023",
    "name": "pkm prefix calendar-looking text #2",
    "bucket": "obvious",
    "failure_tags": [
      "prefix_override"
    ],
    "input": {
      "text": "Pkm: calendar tomorrow 3pm"
    },
    "expect": {
      "route": "pkm_capture"
    }
  },
  {
    "case_id": "R-OBV-024",
    "name": "google maps",
    "bucket": "obvious",
    "failure_tags": [
      "url"
    ],
    "input": {
      "text": "https://maps.app.goo.gl/AxP18sEiQegN4Yva7"
    },
    "expect": {
      "route": "calendar_create"
    }
  },
  {
    "case_id": "R-OBV-025",
    "name": "google maps #2",
    "bucket": "obvious",
    "failure_tags": [
      "url"
    ],
    "input": {
      "text": "https://www.google.com/maps/place/Levant+Halal+Mediterranean+Cafe+Cafe+%26+Grill/@30.4873472,-97.8419712,15z/data=!4m6!3m5!1s0x865b2df31ef9d36d:0xa7721a73b24dfb30!8m2!3d30.4836808!4d-97.8309779!16s%2Fg%2F11h71tcbb1?entry=ttu&g_ep=EgoyMDI2MDMyOS4wIKXMDSoASAFQAw%3D%3D"
    },
    "expect": {
      "route": "calendar_create"
    }
  },
  {
    "case_id": "R-OBV-026",
    "name": "apple maps",
    "bucket": "obvious",
    "failure_tags": [
      "url"
    ],
    "input": {
      "text": "https://maps.apple/p/rgiGMibihR3WD-"
    },
    "expect": {
      "route": "calendar_create"
    }
  },
  {
    "case_id": "R-OBV-028",
    "name": "webpage",
    "bucket": "obvious",
    "failure_tags": [
      "url"
    ],
    "input": {
      "text": "https://paulgraham.com/greatwork.html"
    },
    "expect": {
      "route": "pkm_capture"
    }
  },
  {
    "case_id": "R-OBV-027",
    "name": "apple maps #2",
    "bucket": "obvious",
    "failure_tags": [
      "url"
    ],
    "input": {
      "text": "https://maps.apple.com/place?place-id=I5804726049066B19&address=204+E+Little+Elm+Trail%2C+Cedar+Park%2C+TX++78613%2C+United+States&coordinate=30.492289%2C-97.807558&name=Twin+Lakes+Park&_provider=9902"
    },
    "expect": {
      "route": "calendar_create"
    }
  },
  {
    "case_id": "R-OBV-029",
    "name": "short",
    "bucket": "obvious",
    "failure_tags": [
      "baseline_route"
    ],
    "input": {
      "text": "tomorrow"
    },
    "expect": {
      "route": "calendar_query"
    }
  },
  {
    "case_id": "R-OBV-030",
    "name": "short and clear",
    "bucket": "obvious",
    "failure_tags": [
      "baseline_route"
    ],
    "input": {
      "text": "events today"
    },
    "expect": {
      "route": "calendar_query"
    }
  },
  {
    "case_id": "R-OBV-031",
    "name": "events monday",
    "bucket": "obvious",
    "failure_tags": [
      "baseline_route"
    ],
    "input": {
      "text": "events monday"
    },
    "expect": {
      "route": "calendar_query"
    }
  },
  {
    "case_id": "R-OBV-032",
    "name": "calendar friday",
    "bucket": "obvious",
    "failure_tags": [
      "baseline_route"
    ],
    "input": {
      "text": "calendar friday"
    },
    "expect": {
      "route": "calendar_query"
    }
  },
  {
    "case_id": "R-OBV-033",
    "name": "plans today",
    "bucket": "obvious",
    "failure_tags": [
      "baseline_route"
    ],
    "input": {
      "text": "plans today"
    },
    "expect": {
      "route": "calendar_query"
    }
  },
  {
    "case_id": "R-OBV-034",
    "name": "schedule today",
    "bucket": "obvious",
    "failure_tags": [
      "baseline_route"
    ],
    "input": {
      "text": "schedule today"
    },
    "expect": {
      "route": "calendar_query"
    }
  },
  {
    "case_id": "R-OBV-035",
    "name": "meeting tomorrow",
    "bucket": "obvious",
    "failure_tags": [
      "baseline_route"
    ],
    "input": {
      "text": "meeting tomorrow"
    },
    "expect": {
      "route": "calendar_create"
    }
  },
  {
    "case_id": "R-AMB-001",
    "name": "calendar tomorrow with time",
    "bucket": "ambiguous",
    "failure_tags": [
      "bad_clarification_decision"
    ],
    "input": {
      "text": "calendar tomorrow 3pm"
    },
    "expect": {
      "route": "ambiguous"
    }
  },
  {